{
 "dataset": "stellaris_archaeological_sites",
 "kind": "archaeological_site",
 "schema": "stellaris-discovery/2.1",
 "version": "2.1",
 "generated": "2026-08-30",
 "source": "https://stellaris.paradoxwikis.com/Archaeological_site (all data inline on that page) plus https://stellaris.paradoxwikis.com/Template:Reward for code expansion",
 "notes": null,
 "coverage": {
  "entities": 110,
  "chapters": 429,
  "finder_rows": 209
 },
 "mechanics": [
  "A site must be inside your borders (or reachable) and needs a scientist plus a science ship. Each excavation phase is 90 days; AI empires take twice as long.",
  "Roll = d10 + scientist skill + bonuses + clues - chapter difficulty. Scientist skill is leader level plus trait modifiers, and the Curator Archaeology Lab technology adds to it.",
  "14+ completes the chapter (75 XP). 11-13 gives 2 clues for the next phase (40 XP). 6-10 gives 1 clue (25 XP). 5 or less may fire a mishap event (10 XP).",
  "On completion a site has a 67% chance to leave a minor artifacts deposit: 80% of the time value 1, 16% value 2, 4% value 3. The Antiquarian trait adds +5% deposit chance per level.",
  "Mishap events (roll 5 or less) are flavoured per site type but mechanically identical: excavating scientist dies (-2 clues); team members die (-1 clue); danger avoided (+3 clues); pay 100 Energy for +3 clues or lose 2; scientist gains the Maimed trait."
 ],
 "reward_codes": [
  {
   "code": "art1",
   "meaning": "6x minor artifacts, clamped to 50 / 150 / 250 by game stage"
  },
  {
   "code": "art2",
   "meaning": "6x minor artifacts, clamped to 300 / 400 / 500"
  },
  {
   "code": "art3",
   "meaning": "6x minor artifacts, clamped to 750 / 1,000 / 1,500"
  },
  {
   "code": "mat1",
   "meaning": "6x of the named resource (100~1,000)"
  },
  {
   "code": "mat2",
   "meaning": "12x of the named resource (150~2,000)"
  },
  {
   "code": "mat3",
   "meaning": "18x of the named resource (250~5,000)"
  },
  {
   "code": "mat4",
   "meaning": "24x of the named resource (350~10,000)"
  },
  {
   "code": "mat5",
   "meaning": "48x of the named resource (700~30,000)"
  },
  {
   "code": "rsh1 / res1",
   "meaning": "12x of the named research (250~100,000)"
  },
  {
   "code": "rsh2 / res2",
   "meaning": "18x of the named research (350~100,000)"
  },
  {
   "code": "rsh3 / res3",
   "meaning": "24x of the named research (500~1,000,000)"
  },
  {
   "code": "rsh4 / res4",
   "meaning": "48x of the named research (1,000~1,000,000)"
  },
  {
   "code": "rsh5 / res5",
   "meaning": "96x of the named research (2,000~2,000,000)"
  },
  {
   "code": "uni1",
   "meaning": "6x Unity (100~100,000)"
  },
  {
   "code": "uni2",
   "meaning": "12x Unity (150~100,000)"
  },
  {
   "code": "uni3",
   "meaning": "18x Unity (250~1,000,000)"
  },
  {
   "code": "uni4",
   "meaning": "24x Unity (350~1,000,000)"
  },
  {
   "code": "uni5",
   "meaning": "48x Unity (700~2,000,000)"
  },
  {
   "code": "inf1",
   "meaning": "6x Influence (40~100)"
  },
  {
   "code": "inf2",
   "meaning": "12x Influence (80~175)"
  },
  {
   "code": "inf3",
   "meaning": "18x Influence (125~250)"
  }
 ],
 "groups": [
  {
   "key": "base",
   "label": "Base game sites"
  },
  {
   "key": "unique_system",
   "label": "Unique system sites"
  },
  {
   "key": "origin",
   "label": "Origin sites"
  },
  {
   "key": "precursor",
   "label": "Precursor sites"
  },
  {
   "key": "ancient_relics",
   "label": "Ancient Relics sites"
  },
  {
   "key": "other_expansion",
   "label": "Other expansion sites"
  }
 ],
 "entities": [
  {
   "id": "ancient-capital-site",
   "uid": "site:ancient-capital-site",
   "kind": "archaeological_site",
   "name": "Ancient Capital Site",
   "group": "base",
   "group_label": "Base game sites",
   "dlc": "Base game",
   "precursor": null,
   "system": null,
   "requirements": "Habitable planet",
   "restrictions": null,
   "notes": null,
   "chapters": [
    {
     "id": "1",
     "index": 1,
     "title": null,
     "rewards": [
      "art1 minor artifacts",
      "mat1 Society research"
     ],
     "choices": []
    },
    {
     "id": "2",
     "index": 2,
     "title": null,
     "rewards": [
      "ast1 astral threads",
      "mat2 Physics research"
     ],
     "choices": []
    },
    {
     "id": "3",
     "index": 3,
     "title": null,
     "rewards": [
      "50% progress toward the least advanced unresearched of Gene Seed Purification, Targeted Gene Expressions, Glandular Acclimation, Gene Tailoring, Genome Mapping",
      "rsh3 Society research instead if Gene Seed Purification is already researched",
      "Skrand Sharpbeak, if you have him, gains 800 experience"
     ],
     "choices": []
    },
    {
     "id": "4",
     "index": 4,
     "title": null,
     "rewards": [
      "art1 minor artifacts",
      "mat2 Society research"
     ],
     "choices": []
    },
    {
     "id": "5",
     "index": 5,
     "title": null,
     "rewards": [
      "art1 minor artifacts",
      "mat2 Society research"
     ],
     "choices": []
    },
    {
     "id": "6",
     "index": 6,
     "title": null,
     "rewards": [
      "(final chapter - see wiki, payout is the art/soc pair again)"
     ],
     "choices": []
    }
   ]
  },
  {
   "id": "ancient-facility",
   "uid": "site:ancient-facility",
   "kind": "archaeological_site",
   "name": "Ancient Facility",
   "group": "base",
   "group_label": "Base game sites",
   "dlc": "Base game",
   "precursor": null,
   "system": null,
   "requirements": "Uninhabitable or non-dry planet",
   "restrictions": null,
   "notes": null,
   "chapters": [
    {
     "id": "1",
     "index": 1,
     "title": null,
     "rewards": [
      "art1 minor artifacts (mat1 Society research without Ancient Relics)"
     ],
     "choices": []
    },
    {
     "id": "2",
     "index": 2,
     "title": null,
     "rewards": [
      "art1 minor artifacts (mat1 Society research without Ancient Relics)"
     ],
     "choices": []
    },
    {
     "id": "3",
     "index": 3,
     "title": null,
     "rewards": [
      "Choice: art2 minor artifacts (mat2 Society research without Ancient Relics)",
      "OR +20% progress toward Universal Macrophage plus Adaptive Evolution situation progress if Evolutionary Predators - needs an organic main species"
     ],
     "choices": []
    }
   ]
  },
  {
   "id": "anomalous-cube",
   "uid": "site:anomalous-cube",
   "kind": "archaeological_site",
   "name": "Anomalous Cube",
   "group": "base",
   "group_label": "Base game sites",
   "dlc": "Base game",
   "precursor": null,
   "system": null,
   "requirements": "Any planet; you have communications with a Fallen Empire and are not at war with it",
   "restrictions": null,
   "notes": "Chapter 1 designates a random non-hostile Fallen Empire as the Anomalous Cube Fallen Empire; the chapter 4 opinion reward points at that empire.",
   "chapters": [
    {
     "id": "1",
     "index": 1,
     "title": null,
     "rewards": [
      "6x Living Metal (100~1,000)",
      "art1 minor artifacts (mat1 Engineering research without Ancient Relics)",
      "Designates the Anomalous Cube Fallen Empire"
     ],
     "choices": []
    },
    {
     "id": "2",
     "index": 2,
     "title": null,
     "rewards": [
      "6x Living Metal (100~1,000)",
      "art1 minor artifacts (mat1 Engineering research without Ancient Relics)",
      "Adaptive Evolution progress if Evolutionary Predators"
     ],
     "choices": []
    },
    {
     "id": "3",
     "index": 3,
     "title": null,
     "rewards": [
      "12x Living Metal (150~2,000)",
      "art2 minor artifacts (mat1 Engineering research without Ancient Relics)"
     ],
     "choices": []
    },
    {
     "id": "4",
     "index": 4,
     "title": null,
     "rewards": [
      "Adds a 1 Living Metal deposit to the planet",
      "12x Living Metal (150~2,000)",
      "art2 minor artifacts (mat1 Alloys without Ancient Relics)",
      "Choice: uni3 Unity and +500 opinion with the Anomalous Cube Fallen Empire (closed if at war, or if they are Ancient Caretakers)",
      "OR +25% Living Metal technology progress and -50% edict cost"
     ],
     "choices": []
    }
   ]
  },
  {
   "id": "message-in-a-bottle",
   "uid": "site:message-in-a-bottle",
   "kind": "archaeological_site",
   "name": "Message in a Bottle",
   "group": "base",
   "group_label": "Base game sites",
   "dlc": "Base game",
   "precursor": null,
   "system": null,
   "requirements": "From the Solar Sails anomaly; not Gestalt Consciousness",
   "restrictions": null,
   "notes": null,
   "chapters": [
    {
     "id": "1",
     "index": 1,
     "title": null,
     "rewards": [
      "art1 minor artifacts"
     ],
     "choices": []
    },
    {
     "id": "2",
     "index": 2,
     "title": null,
     "rewards": [
      "art1 minor artifacts"
     ],
     "choices": []
    },
    {
     "id": "3",
     "index": 3,
     "title": null,
     "rewards": [
      "art1 minor artifacts"
     ],
     "choices": []
    },
    {
     "id": "4",
     "index": 4,
     "title": null,
     "rewards": [
      "art1 minor artifacts"
     ],
     "choices": []
    },
    {
     "id": "5",
     "index": 5,
     "title": null,
     "rewards": [
      "art1 minor artifacts",
      "'Shanty on Repeat' music track",
      "Harmonious Crew empire modifier (ship speed)",
      "Space Shanty specimen [Grand Archive]"
     ],
     "choices": []
    }
   ]
  },
  {
   "id": "message-in-the-canopy",
   "uid": "site:message-in-the-canopy",
   "kind": "archaeological_site",
   "name": "Message in the Canopy",
   "group": "base",
   "group_label": "Base game sites",
   "dlc": "Base game",
   "precursor": null,
   "system": null,
   "requirements": "From the Message in the Canopy colony event",
   "restrictions": null,
   "notes": null,
   "chapters": [
    {
     "id": "1",
     "index": 1,
     "title": null,
     "rewards": [
      "rsh1 Society research"
     ],
     "choices": []
    },
    {
     "id": "2",
     "index": 2,